{
  "id": "texture.reactor_textures_block_pipe_block",
  "type": "texture",
  "name": "pipe_block.png",
  "description": "Existing project asset (indexed by init)",
  "status": "integrated",
  "version": 1,
  "files": [
    {
      "path": "resourcepack/assets/reactor/textures/block/pipe_block.png",
      "role": "primary",
      "sha256": "1de741f0cb0baa967d212298f7d88d2881e7f6d87861df7ff227ad89718ecccc",
      "bytes": 267
    }
  ],
  "source": {},
  "created_at": "2026-10-07T04:50:30.173Z",
  "modified_at": "2026-10-07T04:50:30.173Z",
  "created_by": "import",
  "dependencies": [],
  "minecraft_ids": [
    "reactor:block/pipe_block"
  ],
  "preview": null,
  "tags": [
    "existing"
  ],
  "qa_status": "n/a",
  "qa_history": [],
  "versions": [
    {
      "version": 1,
      "at": "2026-10-07T04:50:30.173Z",
      "by": "import",
      "note": "imported existing project file",
      "files": [
        {
          "path": "resourcepack/assets/reactor/textures/block/pipe_block.png",
          "sha256": "1de741f0cb0baa967d212298f7d88d2881e7f6d87861df7ff227ad89718ecccc"
        }
      ],
      "archived_dir": null,
      "source": {}
    }
  ],
  "metadata": {}
}
