{
  "id": "armory.heartwood_longbow.texture",
  "type": "texture",
  "name": "Heartwood Longbow",
  "description": "",
  "status": "approved",
  "version": 1,
  "files": [
    {
      "path": "resourcepack/assets/studio/textures/item/heartwood_longbow.png",
      "role": "primary",
      "sha256": "c91baa93b5c26435c09364676a27ef87a004e4789c70807bf1c0d9add8e121fa",
      "bytes": 421
    },
    {
      "path": "art/items/heartwood_longbow.item.json",
      "role": "source",
      "sha256": "5ff6764535bd16b479065d275aff4bc806eee830ed7ade0d08aa0107860dc297",
      "bytes": 1483
    }
  ],
  "source": {
    "provider": "item-shader",
    "method": "texture_shade_item",
    "source_files": [
      "art/items/heartwood_longbow.item.json"
    ]
  },
  "created_at": "2026-10-07T06:02:49.764Z",
  "modified_at": "2026-10-07T06:02:49.770Z",
  "created_by": "texture-artist",
  "dependencies": [],
  "minecraft_ids": [
    "studio:item/heartwood_longbow"
  ],
  "preview": ".minecraft-studio/previews/armory_heartwood_longbow_texture.png",
  "tags": [
    "item",
    "bow"
  ],
  "qa_status": "passed",
  "qa_history": [
    {
      "at": "2026-10-07T06:02:49.768Z",
      "by": "visual-qa",
      "version": 1,
      "verdict": "pass",
      "summary": "11 colours",
      "checks": [
        {
          "name": "technical validation",
          "status": "pass",
          "detail": "pass"
        },
        {
          "name": "palette size",
          "status": "pass",
          "detail": "11 colours"
        },
        {
          "name": "silhouette coverage",
          "status": "pass",
          "detail": "34% of the canvas"
        },
        {
          "name": "visual review",
          "status": "pass",
          "detail": "Review sheet checked at 1600%/800%/100%: readable shape, consistent lighting and outline."
        }
      ]
    }
  ],
  "versions": [
    {
      "version": 1,
      "at": "2026-10-07T06:02:49.765Z",
      "by": "texture-artist",
      "note": "initial version",
      "files": [
        {
          "path": "resourcepack/assets/studio/textures/item/heartwood_longbow.png",
          "sha256": "c91baa93b5c26435c09364676a27ef87a004e4789c70807bf1c0d9add8e121fa"
        },
        {
          "path": "art/items/heartwood_longbow.item.json",
          "sha256": "5ff6764535bd16b479065d275aff4bc806eee830ed7ade0d08aa0107860dc297"
        }
      ],
      "archived_dir": ".minecraft-studio/history/armory.heartwood_longbow.texture/v1",
      "source": {
        "provider": "item-shader",
        "method": "texture_shade_item",
        "source_files": [
          "art/items/heartwood_longbow.item.json"
        ]
      }
    }
  ],
  "metadata": {
    "width": 16,
    "height": 16,
    "frames": 1,
    "filled_px": 87,
    "coverage": 0.34,
    "colors": 11
  }
}
