{
  "id": "armory.knight.humanoid_leggings",
  "type": "texture",
  "name": "Knight plate armor (humanoid_leggings)",
  "description": "",
  "status": "approved",
  "version": 1,
  "files": [
    {
      "path": "resourcepack/assets/studio/textures/entity/equipment/humanoid_leggings/knight.png",
      "role": "primary",
      "sha256": "cd13ed36668ba2dff4686df82d3436e051efb92399c7480028ee73019b71777e",
      "bytes": 449
    },
    {
      "path": "art/equipment/knight_humanoid_leggings.paint.json",
      "role": "source",
      "sha256": "9b2698dad376e5be9ef5aaa04ad9677832f0ae46165ef885f7efc3cd76819e10",
      "bytes": 4517
    }
  ],
  "source": {
    "provider": "uv-painter",
    "method": "texture_paint_uv",
    "source_files": [
      "art/equipment/knight_humanoid_leggings.paint.json",
      "renders/template_humanoid_leggings.model.json"
    ],
    "parameters": {
      "materials": [
        "plate"
      ]
    }
  },
  "created_at": "2026-10-07T06:02:50.412Z",
  "modified_at": "2026-10-07T06:02:50.420Z",
  "created_by": "texture-artist",
  "dependencies": [],
  "minecraft_ids": [
    "studio:knight"
  ],
  "preview": ".minecraft-studio/previews/atlas_armory_knight_humanoid_leggings.png",
  "tags": [
    "equipment",
    "knight"
  ],
  "qa_status": "passed",
  "qa_history": [
    {
      "at": "2026-10-07T06:02:50.417Z",
      "by": "visual-qa",
      "version": 1,
      "verdict": "pass",
      "summary": "humanoid_leggings layer",
      "checks": [
        {
          "name": "layout",
          "status": "pass",
          "detail": "64×32 vanilla humanoid layout"
        },
        {
          "name": "worn review",
          "status": "pass",
          "detail": "Checked on the mannequin: pieces line up with head/body/arms/legs; transparent areas show the body underneath."
        }
      ]
    }
  ],
  "versions": [
    {
      "version": 1,
      "at": "2026-10-07T06:02:50.414Z",
      "by": "texture-artist",
      "note": "initial version",
      "files": [
        {
          "path": "resourcepack/assets/studio/textures/entity/equipment/humanoid_leggings/knight.png",
          "sha256": "cd13ed36668ba2dff4686df82d3436e051efb92399c7480028ee73019b71777e"
        },
        {
          "path": "art/equipment/knight_humanoid_leggings.paint.json",
          "sha256": "9b2698dad376e5be9ef5aaa04ad9677832f0ae46165ef885f7efc3cd76819e10"
        }
      ],
      "archived_dir": ".minecraft-studio/history/armory.knight.humanoid_leggings/v1",
      "source": {
        "provider": "uv-painter",
        "method": "texture_paint_uv",
        "source_files": [
          "art/equipment/knight_humanoid_leggings.paint.json",
          "renders/template_humanoid_leggings.model.json"
        ],
        "parameters": {
          "materials": [
            "plate"
          ]
        }
      }
    }
  ],
  "metadata": {
    "width": 64,
    "height": 32,
    "texture_size": [
      64,
      32
    ],
    "cubes": 2,
    "coverage": 0.281
  }
}
