{
  "id": "armory.ember_staff.texture",
  "type": "texture",
  "name": "Ember Staff",
  "description": "",
  "status": "approved",
  "version": 1,
  "files": [
    {
      "path": "resourcepack/assets/studio/textures/item/ember_staff.png",
      "role": "primary",
      "sha256": "40b5549ad9b6320ff5a0289844dbf7220cfb4544e4f2cb1e20623466cb5a8642",
      "bytes": 1275
    },
    {
      "path": "resourcepack/assets/studio/textures/item/ember_staff.png.mcmeta",
      "role": "primary",
      "sha256": "61d9ed0268db7dffd14d04ad022ec2da66c2d5f52c3b3f689331ae53880f9e40",
      "bytes": 70
    },
    {
      "path": "art/items/ember_staff.item.json",
      "role": "source",
      "sha256": "8ecedde4037f540ad87dea3d686846d73a3f57b306a6c86ec79cfd9340b5dda1",
      "bytes": 5550
    }
  ],
  "source": {
    "provider": "item-shader",
    "method": "texture_shade_item",
    "source_files": [
      "art/items/ember_staff.item.json"
    ]
  },
  "created_at": "2026-10-07T06:02:49.849Z",
  "modified_at": "2026-10-07T06:02:49.856Z",
  "created_by": "texture-artist",
  "dependencies": [],
  "minecraft_ids": [
    "studio:item/ember_staff"
  ],
  "preview": ".minecraft-studio/previews/armory_ember_staff_texture.png",
  "tags": [
    "item",
    "staff"
  ],
  "qa_status": "passed",
  "qa_history": [
    {
      "at": "2026-10-07T06:02:49.853Z",
      "by": "visual-qa",
      "version": 1,
      "verdict": "pass",
      "summary": "15 colours, 4 frames",
      "checks": [
        {
          "name": "technical validation",
          "status": "pass",
          "detail": "pass"
        },
        {
          "name": "palette size",
          "status": "pass",
          "detail": "15 colours"
        },
        {
          "name": "silhouette coverage",
          "status": "pass",
          "detail": "28% of the canvas"
        },
        {
          "name": "visual review",
          "status": "pass",
          "detail": "Review sheet checked at 1600%/800%/100%: readable shape, consistent lighting and outline."
        }
      ]
    }
  ],
  "versions": [
    {
      "version": 1,
      "at": "2026-10-07T06:02:49.851Z",
      "by": "texture-artist",
      "note": "initial version",
      "files": [
        {
          "path": "resourcepack/assets/studio/textures/item/ember_staff.png",
          "sha256": "40b5549ad9b6320ff5a0289844dbf7220cfb4544e4f2cb1e20623466cb5a8642"
        },
        {
          "path": "resourcepack/assets/studio/textures/item/ember_staff.png.mcmeta",
          "sha256": "61d9ed0268db7dffd14d04ad022ec2da66c2d5f52c3b3f689331ae53880f9e40"
        },
        {
          "path": "art/items/ember_staff.item.json",
          "sha256": "8ecedde4037f540ad87dea3d686846d73a3f57b306a6c86ec79cfd9340b5dda1"
        }
      ],
      "archived_dir": ".minecraft-studio/history/armory.ember_staff.texture/v1",
      "source": {
        "provider": "item-shader",
        "method": "texture_shade_item",
        "source_files": [
          "art/items/ember_staff.item.json"
        ]
      }
    }
  ],
  "metadata": {
    "width": 16,
    "height": 16,
    "frames": 4,
    "filled_px": 73,
    "coverage": 0.285,
    "colors": 15
  }
}
