{
  "id": "armory.dragonfruit.texture",
  "type": "texture",
  "name": "Dragonfruit",
  "description": "",
  "status": "approved",
  "version": 1,
  "files": [
    {
      "path": "resourcepack/assets/studio/textures/item/dragonfruit.png",
      "role": "primary",
      "sha256": "3a403f6c1b52015a9188f2a1ab25f0cc867711ff4a75f776e68bca334644d8c2",
      "bytes": 535
    },
    {
      "path": "art/items/dragonfruit.item.json",
      "role": "source",
      "sha256": "7edd392da23530a239d59b3ea5688f649fdc050a1ac784c21e7d1cfa4107a82e",
      "bytes": 1343
    }
  ],
  "source": {
    "provider": "item-shader",
    "method": "texture_shade_item",
    "source_files": [
      "art/items/dragonfruit.item.json"
    ]
  },
  "created_at": "2026-10-07T06:02:49.979Z",
  "modified_at": "2026-10-07T06:02:49.985Z",
  "created_by": "texture-artist",
  "dependencies": [],
  "minecraft_ids": [
    "studio:item/dragonfruit"
  ],
  "preview": ".minecraft-studio/previews/armory_dragonfruit_texture.png",
  "tags": [
    "item",
    "fruit"
  ],
  "qa_status": "passed",
  "qa_history": [
    {
      "at": "2026-10-07T06:02:49.982Z",
      "by": "visual-qa",
      "version": 1,
      "verdict": "pass",
      "summary": "10 colours",
      "checks": [
        {
          "name": "technical validation",
          "status": "pass",
          "detail": "17 pixels differ from all 8 neighbours (random noise reads poorly at 16×16)"
        },
        {
          "name": "palette size",
          "status": "pass",
          "detail": "10 colours"
        },
        {
          "name": "silhouette coverage",
          "status": "pass",
          "detail": "67% of the canvas"
        },
        {
          "name": "visual review",
          "status": "pass",
          "detail": "Review sheet checked at 1600%/800%/100%: readable shape, consistent lighting and outline."
        }
      ]
    }
  ],
  "versions": [
    {
      "version": 1,
      "at": "2026-10-07T06:02:49.980Z",
      "by": "texture-artist",
      "note": "initial version",
      "files": [
        {
          "path": "resourcepack/assets/studio/textures/item/dragonfruit.png",
          "sha256": "3a403f6c1b52015a9188f2a1ab25f0cc867711ff4a75f776e68bca334644d8c2",
          "archived": "0-dragonfruit.png"
        },
        {
          "path": "art/items/dragonfruit.item.json",
          "sha256": "7edd392da23530a239d59b3ea5688f649fdc050a1ac784c21e7d1cfa4107a82e",
          "archived": "1-dragonfruit.item.json"
        }
      ],
      "archived_dir": ".minecraft-studio/history/armory.dragonfruit.texture/v1",
      "source": {
        "provider": "item-shader",
        "method": "texture_shade_item",
        "source_files": [
          "art/items/dragonfruit.item.json"
        ]
      }
    }
  ],
  "metadata": {
    "width": 16,
    "height": 16,
    "frames": 1,
    "filled_px": 172,
    "coverage": 0.672,
    "colors": 10
  }
}
