{
  "id": "creatures.badger_smith.model",
  "type": "model",
  "name": "Badger Smith model",
  "description": "",
  "status": "approved",
  "version": 1,
  "files": [
    {
      "path": "bedrock/RP/models/entity/badger_smith.geo.json",
      "role": "primary",
      "sha256": "e286442a26c76934f1451d1227cb92424492742062b5ea633e23d4a9fc9fab52",
      "bytes": 5276
    },
    {
      "path": "models/badger_smith.bbmodel",
      "role": "primary",
      "sha256": "4b83e7e76ed6a7be7660a174ba26ca3ea3b83f37b000207b20cb5a29cab3958d",
      "bytes": 44642
    },
    {
      "path": "art/models/badger_smith.model.json",
      "role": "source",
      "sha256": "efff4f3e07f35939d1c84de60de7dff021dbd98b4b2ea88467cbeadd83748a51",
      "bytes": 4589
    }
  ],
  "source": {
    "provider": "studio-model",
    "format": "minecraft-studio-model/1",
    "source_files": [
      "art/models/badger_smith.model.json"
    ]
  },
  "created_at": "2026-10-07T06:03:25.336Z",
  "modified_at": "2026-10-07T06:03:25.344Z",
  "created_by": "modeler",
  "dependencies": [
    "creatures.badger_smith.texture"
  ],
  "minecraft_ids": [
    "geometry.badger_smith"
  ],
  "preview": ".minecraft-studio/previews/model_badger_smith.png",
  "tags": [
    "creature",
    "anthropomorphic"
  ],
  "qa_status": "passed",
  "qa_history": [
    {
      "at": "2026-10-07T06:03:25.341Z",
      "by": "visual-qa",
      "version": 1,
      "verdict": "pass",
      "summary": "12 cubes",
      "checks": [
        {
          "name": "rig validation",
          "status": "pass",
          "detail": "12 cubes, bones leg_r/leg_l/body/head/arm_r/arm_l/hammer"
        },
        {
          "name": "size",
          "status": "pass",
          "detail": "1 × 2.06 × 1 blocks"
        }
      ]
    }
  ],
  "versions": [
    {
      "version": 1,
      "at": "2026-10-07T06:03:25.339Z",
      "by": "modeler",
      "note": "initial version",
      "files": [
        {
          "path": "bedrock/RP/models/entity/badger_smith.geo.json",
          "sha256": "e286442a26c76934f1451d1227cb92424492742062b5ea633e23d4a9fc9fab52"
        },
        {
          "path": "models/badger_smith.bbmodel",
          "sha256": "4b83e7e76ed6a7be7660a174ba26ca3ea3b83f37b000207b20cb5a29cab3958d"
        },
        {
          "path": "art/models/badger_smith.model.json",
          "sha256": "efff4f3e07f35939d1c84de60de7dff021dbd98b4b2ea88467cbeadd83748a51"
        }
      ],
      "archived_dir": ".minecraft-studio/history/creatures.badger_smith.model/v1",
      "source": {
        "provider": "studio-model",
        "format": "minecraft-studio-model/1",
        "source_files": [
          "art/models/badger_smith.model.json"
        ]
      }
    }
  ],
  "metadata": {
    "bones": [
      "leg_r",
      "leg_l",
      "body",
      "head",
      "arm_r",
      "arm_l",
      "hammer"
    ],
    "texture_size": [
      64,
      64
    ]
  }
}
