{
  "id": "timeline.reactor_startup",
  "type": "timeline",
  "name": "Reactor start sequence",
  "description": "Synchronised timeline (event, sfx, voice, animation, particles, texture, lighting, music, ui, state)",
  "status": "approved",
  "version": 1,
  "files": [
    {
      "path": ".minecraft-studio/timelines/reactor_startup.json",
      "role": "primary",
      "sha256": "4433b07ce6c9a2c1d5be44a3780fbb251e47de7b469e7527018efb281e45c2a2",
      "bytes": 2312
    },
    {
      "path": "src/main/resources/timelines/reactor_startup.json",
      "role": "primary",
      "sha256": "9916049190060dbe5885743aa16b37a38e4e5d388e8ffe4e1dc0fbcedb15dd43",
      "bytes": 2669
    }
  ],
  "source": {
    "format": "minecraft-studio-timeline/1"
  },
  "created_at": "2026-10-07T04:41:32.684Z",
  "modified_at": "2026-10-07T04:41:32.694Z",
  "created_by": "animator",
  "dependencies": [],
  "minecraft_ids": [],
  "preview": null,
  "tags": [
    "timeline"
  ],
  "qa_status": "passed",
  "qa_history": [
    {
      "at": "2026-10-07T04:41:32.691Z",
      "by": "integration-qa",
      "version": 1,
      "verdict": "pass",
      "summary": "7.75s, 18 cues",
      "checks": [
        {
          "name": "timeline validation",
          "status": "pass",
          "detail": "all cues valid"
        },
        {
          "name": "sound events exist",
          "status": "pass",
          "detail": "checked against sounds.json"
        }
      ]
    }
  ],
  "versions": [
    {
      "version": 1,
      "at": "2026-10-07T04:41:32.687Z",
      "by": "animator",
      "note": "initial version",
      "files": [
        {
          "path": ".minecraft-studio/timelines/reactor_startup.json",
          "sha256": "4433b07ce6c9a2c1d5be44a3780fbb251e47de7b469e7527018efb281e45c2a2"
        },
        {
          "path": "src/main/resources/timelines/reactor_startup.json",
          "sha256": "9916049190060dbe5885743aa16b37a38e4e5d388e8ffe4e1dc0fbcedb15dd43"
        }
      ],
      "archived_dir": ".minecraft-studio/history/timeline.reactor_startup/v1",
      "source": {
        "format": "minecraft-studio-timeline/1"
      }
    }
  ],
  "metadata": {}
}
