{
  "id": "model.reactor_models_block_hazard_stripes",
  "type": "model",
  "name": "hazard_stripes.json",
  "description": "Existing project asset (indexed by init)",
  "status": "integrated",
  "version": 1,
  "files": [
    {
      "path": "resourcepack/assets/reactor/models/block/hazard_stripes.json",
      "role": "primary",
      "sha256": "2a0b432263426723dcfd4116532b3b7a609e8139f5cd5cc32f43f39ba5bad342",
      "bytes": 106
    }
  ],
  "source": {},
  "created_at": "2026-10-07T04:41:14.579Z",
  "modified_at": "2026-10-07T04:41:14.579Z",
  "created_by": "import",
  "dependencies": [],
  "minecraft_ids": [
    "reactor:block/hazard_stripes"
  ],
  "preview": null,
  "tags": [
    "existing"
  ],
  "qa_status": "n/a",
  "qa_history": [],
  "versions": [
    {
      "version": 1,
      "at": "2026-10-07T04:41:14.579Z",
      "by": "import",
      "note": "imported existing project file",
      "files": [
        {
          "path": "resourcepack/assets/reactor/models/block/hazard_stripes.json",
          "sha256": "2a0b432263426723dcfd4116532b3b7a609e8139f5cd5cc32f43f39ba5bad342"
        }
      ],
      "archived_dir": null,
      "source": {}
    }
  ],
  "metadata": {}
}
